<?xml version="1.0" encoding="UTF-8"?>
<tns:Employees>
<tns:EmployeeRecord xmlns:tns="http://www.example.org/Employee" xmlns:xsi="http://www.w3.org/2001/XMLSchema-instance" xsi:schemaLocation="http://www.example.org/Employee Employee.xsd ">
  <tns:EmployeeID>1</tns:EmployeeID>
  <tns:FirstName>John1</tns:FirstName>
  <tns:LastName>Smith1</tns:LastName>
  <tns:DateOfBirth>1975-01-01</tns:DateOfBirth>
  <tns:DepartmentLevel1>1</tns:DepartmentLevel1>
  <tns:FilterKey>1</tns:FilterKey>
  <tns:Dummy1>tns:Dummy1</tns:Dummy1>
  <tns:Dummy2>tns:Dummy2</tns:Dummy2>
  <tns:Dummy3>tns:Dummy3</tns:Dummy3>
  <tns:Dummy4>tns:Dummy4</tns:Dummy4>
  <tns:Dummy5>tns:Dummy5</tns:Dummy5>
  <tns:Dummy6>tns:Dummy6</tns:Dummy6>
  <tns:Dummy7>tns:Dummy7</tns:Dummy7>
  <tns:Dummy8>tns:Dummy8</tns:Dummy8>
  <tns:Dummy9>tns:Dummy9</tns:Dummy9>
  <tns:Dummy10>tns:Dummy10</tns:Dummy10>
  <tns:Dummy11>tns:Dummy11</tns:Dummy11>
  <tns:Dummy12>tns:Dummy12</tns:Dummy12>
  <tns:Dummy13>tns:Dummy13</tns:Dummy13>
  <tns:Dummy14>tns:Dummy14</tns:Dummy14>
</tns:EmployeeRecord>
<tns:EmployeeRecord xmlns:tns="http://www.example.org/Employee" xmlns:xsi="http://www.w3.org/2001/XMLSchema-instance" xsi:schemaLocation="http://www.example.org/Employee Employee.xsd ">
  <tns:EmployeeID>2</tns:EmployeeID>
  <tns:FirstName>John2</tns:FirstName>
  <tns:LastName>Smith2</tns:LastName>
  <tns:DateOfBirth>1975-01-02</tns:DateOfBirth>
  <tns:DepartmentLevel1>2</tns:DepartmentLevel1>
  <tns:FilterKey>2</tns:FilterKey>
  <tns:Dummy1>tns:Dummy1</tns:Dummy1>
  <tns:Dummy2>tns:Dummy2</tns:Dummy2>
  <tns:Dummy3>tns:Dummy3</tns:Dummy3>
  <tns:Dummy4>tns:Dummy4</tns:Dummy4>
  <tns:Dummy5>tns:Dummy5</tns:Dummy5>
  <tns:Dummy6>tns:Dummy6</tns:Dummy6>
  <tns:Dummy7>tns:Dummy7</tns:Dummy7>
  <tns:Dummy8>tns:Dummy8</tns:Dummy8>
  <tns:Dummy9>tns:Dummy9</tns:Dummy9>
  <tns:Dummy10>tns:Dummy10</tns:Dummy10>
  <tns:Dummy11>tns:Dummy11</tns:Dummy11>
  <tns:Dummy12>tns:Dummy12</tns:Dummy12>
  <tns:Dummy13>tns:Dummy13</tns:Dummy13>
  <tns:Dummy14>tns:Dummy14</tns:Dummy14>
</tns:EmployeeRecord>
<tns:EmployeeRecord xmlns:tns="http://www.example.org/Employee" xmlns:xsi="http://www.w3.org/2001/XMLSchema-instance" xsi:schemaLocation="http://www.example.org/Employee Employee.xsd ">
  <tns:EmployeeID>3</tns:EmployeeID>
  <tns:FirstName>John3</tns:FirstName>
  <tns:LastName>Smith3</tns:LastName>
  <tns:DateOfBirth>1975-01-03</tns:DateOfBirth>
  <tns:DepartmentLevel1>3</tns:DepartmentLevel1>
  <tns:FilterKey>3</tns:FilterKey>
  <tns:Dummy1>tns:Dummy1</tns:Dummy1>
  <tns:Dummy2>tns:Dummy2</tns:Dummy2>
  <tns:Dummy3>tns:Dummy3</tns:Dummy3>
  <tns:Dummy4>tns:Dummy4</tns:Dummy4>
  <tns:Dummy5>tns:Dummy5</tns:Dummy5>
  <tns:Dummy6>tns:Dummy6</tns:Dummy6>
  <tns:Dummy7>tns:Dummy7</tns:Dummy7>
  <tns:Dummy8>tns:Dummy8</tns:Dummy8>
  <tns:Dummy9>tns:Dummy9</tns:Dummy9>
  <tns:Dummy10>tns:Dummy10</tns:Dummy10>
  <tns:Dummy11>tns:Dummy11</tns:Dummy11>
  <tns:Dummy12>tns:Dummy12</tns:Dummy12>
  <tns:Dummy13>tns:Dummy13</tns:Dummy13>
  <tns:Dummy14>tns:Dummy14</tns:Dummy14>
</tns:EmployeeRecord>
<tns:EmployeeRecord xmlns:tns="http://www.example.org/Employee" xmlns:xsi="http://www.w3.org/2001/XMLSchema-instance" xsi:schemaLocation="http://www.example.org/Employee Employee.xsd ">
  <tns:EmployeeID>4</tns:EmployeeID>
  <tns:FirstName>John4</tns:FirstName>
  <tns:LastName>Smith4</tns:LastName>
  <tns:DateOfBirth>1975-01-04</tns:DateOfBirth>
  <tns:DepartmentLevel1>4</tns:DepartmentLevel1>
  <tns:FilterKey>4</tns:FilterKey>
  <tns:Dummy1>tns:Dummy1</tns:Dummy1>
  <tns:Dummy2>tns:Dummy2</tns:Dummy2>
  <tns:Dummy3>tns:Dummy3</tns:Dummy3>
  <tns:Dummy4>tns:Dummy4</tns:Dummy4>
  <tns:Dummy5>tns:Dummy5</tns:Dummy5>
  <tns:Dummy6>tns:Dummy6</tns:Dummy6>
  <tns:Dummy7>tns:Dummy7</tns:Dummy7>
  <tns:Dummy8>tns:Dummy8</tns:Dummy8>
  <tns:Dummy9>tns:Dummy9</tns:Dummy9>
  <tns:Dummy10>tns:Dummy10</tns:Dummy10>
  <tns:Dummy11>tns:Dummy11</tns:Dummy11>
  <tns:Dummy12>tns:Dummy12</tns:Dummy12>
  <tns:Dummy13>tns:Dummy13</tns:Dummy13>
  <tns:Dummy14>tns:Dummy14</tns:Dummy14>
</tns:EmployeeRecord>
<tns:EmployeeRecord xmlns:tns="http://www.example.org/Employee" xmlns:xsi="http://www.w3.org/2001/XMLSchema-instance" xsi:schemaLocation="http://www.example.org/Employee Employee.xsd ">
  <tns:EmployeeID>5</tns:EmployeeID>
  <tns:FirstName>John5</tns:FirstName>
  <tns:LastName>Smith5</tns:LastName>
  <tns:DateOfBirth>1975-01-05</tns:DateOfBirth>
  <tns:DepartmentLevel1>5</tns:DepartmentLevel1>
  <tns:FilterKey>1</tns:FilterKey>
  <tns:Dummy1>tns:Dummy1</tns:Dummy1>
  <tns:Dummy2>tns:Dummy2</tns:Dummy2>
  <tns:Dummy3>tns:Dummy3</tns:Dummy3>
  <tns:Dummy4>tns:Dummy4</tns:Dummy4>
  <tns:Dummy5>tns:Dummy5</tns:Dummy5>
  <tns:Dummy6>tns:Dummy6</tns:Dummy6>
  <tns:Dummy7>tns:Dummy7</tns:Dummy7>
  <tns:Dummy8>tns:Dummy8</tns:Dummy8>
  <tns:Dummy9>tns:Dummy9</tns:Dummy9>
  <tns:Dummy10>tns:Dummy10</tns:Dummy10>
  <tns:Dummy11>tns:Dummy11</tns:Dummy11>
  <tns:Dummy12>tns:Dummy12</tns:Dummy12>
  <tns:Dummy13>tns:Dummy13</tns:Dummy13>
  <tns:Dummy14>tns:Dummy14</tns:Dummy14>
</tns:EmployeeRecord>
<tns:EmployeeRecord xmlns:tns="http://www.example.org/Employee" xmlns:xsi="http://www.w3.org/2001/XMLSchema-instance" xsi:schemaLocation="http://www.example.org/Employee Employee.xsd ">
  <tns:EmployeeID>6</tns:EmployeeID>
  <tns:FirstName>John6</tns:FirstName>
  <tns:LastName>Smith6</tns:LastName>
  <tns:DateOfBirth>1975-01-06</tns:DateOfBirth>
  <tns:DepartmentLevel1>6</tns:DepartmentLevel1>
  <tns:FilterKey>2</tns:FilterKey>
  <tns:Dummy1>tns:Dummy1</tns:Dummy1>
  <tns:Dummy2>tns:Dummy2</tns:Dummy2>
  <tns:Dummy3>tns:Dummy3</tns:Dummy3>
  <tns:Dummy4>tns:Dummy4</tns:Dummy4>
  <tns:Dummy5>tns:Dummy5</tns:Dummy5>
  <tns:Dummy6>tns:Dummy6</tns:Dummy6>
  <tns:Dummy7>tns:Dummy7</tns:Dummy7>
  <tns:Dummy8>tns:Dummy8</tns:Dummy8>
  <tns:Dummy9>tns:Dummy9</tns:Dummy9>
  <tns:Dummy10>tns:Dummy10</tns:Dummy10>
  <tns:Dummy11>tns:Dummy11</tns:Dummy11>
  <tns:Dummy12>tns:Dummy12</tns:Dummy12>
  <tns:Dummy13>tns:Dummy13</tns:Dummy13>
  <tns:Dummy14>tns:Dummy14</tns:Dummy14>
</tns:EmployeeRecord>
<tns:EmployeeRecord xmlns:tns="http://www.example.org/Employee" xmlns:xsi="http://www.w3.org/2001/XMLSchema-instance" xsi:schemaLocation="http://www.example.org/Employee Employee.xsd ">
  <tns:EmployeeID>3</tns:EmployeeID>
  <tns:FirstName>John3</tns:FirstName>
  <tns:LastName>Smith3</tns:LastName>
  <tns:DateOfBirth>1975-01-07</tns:DateOfBirth>
  <tns:DepartmentLevel1>7</tns:DepartmentLevel1>
  <tns:FilterKey>3</tns:FilterKey>
  <tns:Dummy1>tns:Dummy1</tns:Dummy1>
  <tns:Dummy2>tns:Dummy2</tns:Dummy2>
  <tns:Dummy3>tns:Dummy3</tns:Dummy3>
  <tns:Dummy4>tns:Dummy4</tns:Dummy4>
  <tns:Dummy5>tns:Dummy5</tns:Dummy5>
  <tns:Dummy6>tns:Dummy6</tns:Dummy6>
  <tns:Dummy7>tns:Dummy7</tns:Dummy7>
  <tns:Dummy8>tns:Dummy8</tns:Dummy8>
  <tns:Dummy9>tns:Dummy9</tns:Dummy9>
  <tns:Dummy10>tns:Dummy10</tns:Dummy10>
  <tns:Dummy11>tns:Dummy11</tns:Dummy11>
  <tns:Dummy12>tns:Dummy12</tns:Dummy12>
  <tns:Dummy13>tns:Dummy13</tns:Dummy13>
  <tns:Dummy14>tns:Dummy14</tns:Dummy14>
</tns:EmployeeRecord>
<tns:EmployeeRecord xmlns:tns="http://www.example.org/Employee" xmlns:xsi="http://www.w3.org/2001/XMLSchema-instance" xsi:schemaLocation="http://www.example.org/Employee Employee.xsd ">
  <tns:EmployeeID>4</tns:EmployeeID>
  <tns:FirstName>John4</tns:FirstName>
  <tns:LastName>Smith4</tns:LastName>
  <tns:DateOfBirth>1975-01-08</tns:DateOfBirth>
  <tns:DepartmentLevel1>8</tns:DepartmentLevel1>
  <tns:FilterKey>4</tns:FilterKey>
  <tns:Dummy1>tns:Dummy1</tns:Dummy1>
  <tns:Dummy2>tns:Dummy2</tns:Dummy2>
  <tns:Dummy3>tns:Dummy3</tns:Dummy3>
  <tns:Dummy4>tns:Dummy4</tns:Dummy4>
  <tns:Dummy5>tns:Dummy5</tns:Dummy5>
  <tns:Dummy6>tns:Dummy6</tns:Dummy6>
  <tns:Dummy7>tns:Dummy7</tns:Dummy7>
  <tns:Dummy8>tns:Dummy8</tns:Dummy8>
  <tns:Dummy9>tns:Dummy9</tns:Dummy9>
  <tns:Dummy10>tns:Dummy10</tns:Dummy10>
  <tns:Dummy11>tns:Dummy11</tns:Dummy11>
  <tns:Dummy12>tns:Dummy12</tns:Dummy12>
  <tns:Dummy13>tns:Dummy13</tns:Dummy13>
  <tns:Dummy14>tns:Dummy14</tns:Dummy14>
</tns:EmployeeRecord>
</tns:Employees>